id;town;street;house
910;п. Южно-Сахалинск; ул. Ленская;340
911;ст. Домбай; пер. Медицинский;289
912;ст. Мостовской; алл. Просвещения;220
913;ст. Горно-Алтайск; ш. Марта 8;77
914;ст. Забайкальск; ул. Войкова;295
915;с. Красновишерск; наб. Лесная;331
916;п. Нижневартовск; пр. Гайдара;132
917;к. Тихвин; алл. Буденного;74
918;клх Усть-Кулом; пр. Мелиораторов;192
919;к. Бийск; бул. Добролюбова;354
920;клх Тавда; наб. Огородная;82
921;к. Раменское; наб. Кочубея;175
922;клх Оленек; пер. Санаторный;303
923;г. Северодвинск; ш. Рабочее;228
924;клх Биробиджан; наб. Культуры;123
925;д. Шуя; бул. К.Маркса;83
926;д. Кыштым; ш. Новоселов;100
927;п. Уварово; бул. Троицкий;297
928;клх Чулым; пер. Медицинский;31
929;к. Певек; алл. Подстанция;159
930;д. Брянск; ш. Ударное;338
931;с. Морозовск; алл. Февральская;276
932;д. Гдов; пр. Ореховый;102
933;п. Павловская; пер. Бабушкина;54
934;клх Уренгой; ш. Красных Партизан;321
935;к. Дно; пр. Больничный;303
936;клх Луховицы; бул. Дальневосточный;164
937;к. Бреды; наб. Советской Армии;195
938;д. Колпашево; алл. Просвещения;84
939;к. Ступино; бул. Тополиный;159
940;с. Беломорск; пр. 1 Мая;393
941;д. Барнаул; пр. Достоевского;397
942;ст. Владивосток; пр. Советов;26
943;к. Волгоград; бул. Щорса;121
944;д. Мокшан; пер. 1 Мая;207
945;к. Новосибирск; пр. Суворова;386
946;п. Уварово; пр. Фурманова;272
947;г. Кропоткин (Краснод.); пер. Учительский;98
948;п. Невьянск; пр. Поселковый;400
949;клх Макаров; ш. Павлика Морозова;263
950;п. Сосновый Бор; пр. Сурикова;216
951;к. Нефтекамск; ул. Тупиковая;188
952;ст. Мичуринск; ш. Ростовское;99
953;п. Ярославль; ул. Халтурина;307
954;с. Дно; алл. Лермонтова;182
955;г. Переславль-Залесский; наб. Авиационная;264
956;клх Байкальск; пр. Матросова;236
957;к. Серафимович; ул. Васильковая;337
958;клх Ухта; алл. Запорожская;217
959;г. Тутаев; бул. Шмидта;29
960;г. Красноуральск; алл. Песочная;149
961;д. Усмань; пр. Курчатова;397
962;п. Палана; ш. Энтузиастов;270
963;клх Мезень; пер. 40 лет Октября;392
964;клх Челябинск; ш. Гоголя;302
965;г. Рыльск; алл. Астраханская;396
966;г. Суздаль; наб. Урожайная;147
967;клх Верхоянск; пер. Восьмого Марта;315
968;к. Владикавказ; алл. Краснодарская;68
969;ст. Волгоград; пр. Боровой;156
970;ст. Макушино; наб. Гастелло;167
971;п. Нязепетровск; пер. Байкальский;132
972;с. Набережные Челны; наб. Ворошилова;77
973;г. Объячево; наб. Огородная;353
974;клх Валаам; пр. Шоссейный;219
975;ст. Новокузнецк; ул. Тепличная;341
976;п. Завьялиха; наб. Клубная;47
977;клх Каргасок; наб. Толстого;182
978;п. Асино; ш. Камское;213
979;д. Ейск; алл. Южная;280
980;клх Оса; алл. Заозерная;247
981;д. Чебаркуль; наб. Азина;52
982;г. Ельня; ул. Специалистов;144
983;ст. Урай; пер. Привольный;38
984;д. Фатеж; бул. Репина;81
985;г. Уэлен; пер. Подстанция;5
986;п. Ишим; наб. Осипенко;338
987;д. Мценск; ул. Механизаторов;98
988;ст. Белореченск; алл. Каштановая;162
989;к. Малгобек; пр. Тенистый;343
990;г. Воткинск; пр. Горный;249
991;к. Ессентуки; бул. Революционный;151
992;ст. Магадан; ул. Крестьянская;102
993;ст. Великий Устюг; пр. Островского;93
994;д. Нерчинск; пр. К.Маркса;83
995;г. Чебаркуль; алл. Гаражная;98
996;д. Петропавловск-Камчатский; пер. Маяковского;336
997;клх Ессентуки; пр. Марта 8;230
998;п. Краснокамск; ул. Литейная;258
999;клх Мытищи; бул. Ильича;382
1000;ст. Оленек; пр. Новоселов;112
